[verification-suite] 2026-02-14T13:17:11Z :: cargo audit
    Fetching advisory database from `https://github.com/RustSec/advisory-db.git`
      Loaded 920 security advisories (from /home/dimas/.cargo/advisory-db)
    Updating crates.io index
    Scanning Cargo.lock for vulnerabilities (337 crate dependencies)
Crate:     bincode
Version:   1.3.3
Warning:   unmaintained
Title:     Bincode is unmaintained
Date:      2025-12-16
ID:        RUSTSEC-2025-0141
URL:       https://rustsec.org/advisories/RUSTSEC-2025-0141
Dependency tree:
bincode 1.3.3
└── baseline 0.1.0
    ├── agent-core 0.1.0
    └── acceptance 0.1.0

Crate:     rustls-pemfile
Version:   2.2.0
Warning:   unmaintained
Title:     rustls-pemfile is unmaintained
Date:      2025-11-28
ID:        RUSTSEC-2025-0134
URL:       https://rustsec.org/advisories/RUSTSEC-2025-0134
Dependency tree:
rustls-pemfile 2.2.0
└── tonic 0.12.3
    └── grpc-client 0.1.0
        ├── agent-core 0.1.0
        └── acceptance 0.1.0

Crate:     lru
Version:   0.12.5
Warning:   unsound
Title:     `IterMut` violates Stacked Borrows by invalidating internal pointer
Date:      2026-01-07
ID:        RUSTSEC-2026-0002
URL:       https://rustsec.org/advisories/RUSTSEC-2026-0002
Dependency tree:
lru 0.12.5
└── platform-linux 0.1.0
    ├── agent-core 0.1.0
    └── acceptance 0.1.0

warning: 3 allowed warnings found
[verification-suite] 2026-02-14T13:17:13Z :: cargo clippy
    Checking acceptance v0.1.0 (/home/dimas/eguard-agent/crates/acceptance)
    Finished `dev` profile [unoptimized + debuginfo] target(s) in 0.74s
[verification-suite] 2026-02-14T13:17:14Z :: cargo fuzz protobuf_parse
    Finished `release` profile [optimized + debuginfo] target(s) in 0.22s
    Finished `release` profile [optimized + debuginfo] target(s) in 0.22s
     Running `fuzz/target/x86_64-unknown-linux-gnu/release/protobuf_parse -artifact_prefix=/home/dimas/eguard-agent/fuzz/artifacts/protobuf_parse/ -max_total_time=30 -verbosity=0 /home/dimas/eguard-agent/fuzz/corpus/protobuf_parse`
INFO: Running with entropic power schedule (0xFF, 100).
INFO:     4936 files found in /home/dimas/eguard-agent/fuzz/corpus/protobuf_parse
INFO: -max_len is not provided; libFuzzer will not generate inputs larger than 4096 bytes
INFO: seed corpus: files: 4936 min: 1b max: 4090b total: 588664b rss: 69Mb
###### Recommended dictionary. ######
"\371\006\000\000\000\000\000\000" # Uses: 11803
"\000\000\000\000" # Uses: 9398
"[\000" # Uses: 9441
"\002\017\032\000\000        \012\012\012" # Uses: 5812
"\000\000\000\361" # Uses: 5504
"          (     " # Uses: 4128
"\021\000\000\000" # Uses: 4620
"\001\000\000\000" # Uses: 2302
"\001\000\000Q" # Uses: 1933
"\017\000\000\000" # Uses: 1774
"\000\000\0001" # Uses: 693
"\001\000\000\000\000\000\000\004" # Uses: 597
"S\000\000\000\000\000\000\000" # Uses: 413
###### End of recommended dictionary. ######
[verification-suite] 2026-02-14T13:17:47Z :: cargo fuzz detection_inputs
    Finished `release` profile [optimized + debuginfo] target(s) in 0.22s
    Finished `release` profile [optimized + debuginfo] target(s) in 0.22s
     Running `fuzz/target/x86_64-unknown-linux-gnu/release/detection_inputs -artifact_prefix=/home/dimas/eguard-agent/fuzz/artifacts/detection_inputs/ -max_total_time=30 -verbosity=0 /home/dimas/eguard-agent/fuzz/corpus/detection_inputs`
INFO: Running with entropic power schedule (0xFF, 100).
INFO:     3955 files found in /home/dimas/eguard-agent/fuzz/corpus/detection_inputs
INFO: -max_len is not provided; libFuzzer will not generate inputs larger than 4096 bytes
INFO: seed corpus: files: 3955 min: 1b max: 696b total: 851981b rss: 68Mb
###### Recommended dictionary. ######
"\001\000" # Uses: 413
"/etc/passwd" # Uses: 350
"\001\000\000\000\000\000\000\000" # Uses: 323
"\013\000\000\000\000\000\000\000" # Uses: 352
"\357\277\275\357\277\275\357\277\275\357\277\275\357\277\275\357\277\275\357\277\275\357\277\275\357\277\275\357\277\275\357\277\275\357\277\275\357\277\275\357\277\275\357\277\275\357\277\275\357\277\275\357\277\275\357\277\275\357\277\275\357\277\275\357" # Uses: 300
"credential" # Uses: 326
"/etc/shadow" # Uses: 321
"\000\354" # Uses: 326
"ssss\357\277\275\357\277\275\357" # Uses: 217
"\017\000\000\000\000\000\000\000" # Uses: 241
"\377\377\377\377\377\377\377#" # Uses: 184
"\377\377\377\377\377\377\377N" # Uses: 241
"\001\000\000\000\000\000\000\001" # Uses: 240
"@@s[\004\015\357\277\275Ys" # Uses: 122
"\377\377\377\377\377\377\377\017" # Uses: 113
"\377\377\377\377\377\377\377\001" # Uses: 61
"\311\000\000\000" # Uses: 38
"\377\377\377\377\377\377\377\377" # Uses: 36
"\000\000\000\000\000\000\000\230" # Uses: 14
###### End of recommended dictionary. ######
[verification-suite] 2026-02-14T13:18:19Z :: cargo miri setup
A sysroot for Miri is already available in `/home/dimas/.cache/miri`.
[verification-suite] 2026-02-14T13:18:19Z :: cargo miri detection tests
    Finished `test` profile [unoptimized + debuginfo] target(s) in 0.12s
     Running unittests src/lib.rs (target/miri/x86_64-unknown-linux-gnu/debug/deps/detection-bc35fd366712299c)

running 61 tests
test memory_scanner::tests::test_filter_regions_executable_and_anonymous ... ok
test memory_scanner::tests::test_filter_regions_executable_only ... ok
test memory_scanner::tests::test_find_suspicious_self ... ok
test memory_scanner::tests::test_parse_maps_content ... ok
test memory_scanner::tests::test_region_size ... ok
test memory_scanner::tests::test_skip_special_regions ... ok
test memory_scanner::tests::test_skip_tiny_regions ... ok
test tests::aho_matcher_scan_runtime_scales_approximately_linearly_with_input_bytes ... ignored, runtime envelope assertions are not meaningful under miri
test tests::aho_matcher_space_scales_with_total_pattern_bytes ... ok
test tests::anomaly_engine_emits_medium_when_above_medium_threshold_only ... ok
test tests::anomaly_engine_flags_distribution_shift ... ok
test tests::anomaly_entropy_guard_requires_minimum_length ... ok
test tests::anomaly_math_matches_probability_and_kl_formulas ... ok
test tests::anomaly_monitor_state_remains_memory_bounded_under_long_streams ... ignored, long-stream anomaly churn test is too slow under miri
test tests::calibration_threshold_matches_sanov_bound ... ok
test tests::confidence_ordering_matches_policy ... ok
test tests::confidence_policy_is_first_match_wins ... ok
test tests::detection_latency_p99_stays_within_budget_for_reference_workload ... ignored, runtime latency assertions are not meaningful under miri
test tests::detection_outcome_includes_rule_names_and_matched_fields_for_traceability ... ok
test tests::detection_workspace_excludes_ml_framework_dependencies ... ignored, spawning rustc/cargo subprocesses is unsupported under miri
test tests::drift_indicators_report_baseline_age_and_kl_quantiles_by_process_family ... ok
test tests::engine_runs_all_layers ... ok
test tests::entropy_flag_policy_requires_min_len_entropy_and_zscore_conditions ... ok
test tests::entropy_math_matches_shannon_definition ... ok
test tests::layer1_append_string_signatures_preserves_existing_patterns ... ok
test tests::layer1_exact_verification_works ... ok
test tests::layer1_loaded_entries_have_no_algorithmic_fn_and_unloaded_have_no_fp ... ok
test tests::layer1_prefilter_negative_short_circuits_to_clean ... ignored, sqlite FFI is unsupported under miri
test tests::layer1_startup_self_check_validates_known_entries_across_prefilter_and_exact_store ... ok
test tests::layer4_evaluation_runtime_is_bounded_with_depth_limited_templates ... ignored, runtime envelope assertions are not meaningful under miri
test tests::layer4_graph_state_is_pruned_by_sliding_window_to_stay_bounded ... ignored, graph pruning stress test is too slow under miri
test tests::layer4_hit_is_scoped_to_current_event_lineage_and_does_not_replay_on_unrelated_events ... ok
test tests::layer4_matches_default_template ... ok
test tests::layer4_pid_reuse_does_not_inherit_stale_non_web_network_signal ... ok
test tests::layer4_template_matching_is_bounded_by_declared_depth ... ok
test tests::replay_harness_is_deterministic ... ok
test tests::replay_quality_gate_emits_metrics_artifact ... ignored, artifact-writing replay quality gate is too slow under miri
test tests::replay_reports_precision_recall_and_false_alarm_upper_bound_by_confidence ... ignored, adversarial replay quality corpus is too slow under miri
test tests::robust_zscore_uses_median_and_mad_baseline ... ok
test tests::sigma_rules_load_from_directory ... ok
test tests::sigma_yaml_compiles_to_bounded_temporal_ast ... ok
test tests::sigma_yaml_missing_within_secs_is_rejected ... ok
test tests::sigma_yaml_rule_compiles_and_fires ... ok
test tests::temporal_engine_accepts_events_within_reorder_tolerance ... ok
test tests::temporal_engine_detects_privilege_escalation_pattern ... ok
test tests::temporal_engine_detects_webshell_pattern ... ok
test tests::temporal_engine_enforces_stage_window ... ok
test tests::temporal_engine_entity_isolation_prevents_cross_pid_matches ... ok
test tests::temporal_engine_eviction_counters_track_retention_and_capacity_reasons ... ok
test tests::temporal_engine_pid_metadata_capacity_evicts_oldest_then_tie_breaks_by_pid ... ok
test tests::temporal_engine_pid_reuse_process_exec_clears_stale_pending_webshell_state ... ok
test tests::temporal_engine_pid_reuse_without_exec_observation_does_not_continue_stale_chain ... ok
test tests::temporal_engine_process_exit_teardown_is_idempotent_and_ignores_stale_out_of_order_exit ... ok
test tests::temporal_engine_process_exit_tears_down_state_and_metadata_immediately ... ok
test tests::temporal_engine_prunes_stale_state_and_pid_metadata_after_retention_horizon ... ok
test tests::temporal_engine_rejects_reorder_beyond_tolerance ... ok
test tests::temporal_engine_rejects_stage_restart_from_timestamp_skew_beyond_tolerance ... ok
test tests::temporal_engine_state_capacity_evicts_oldest_pending_chain_deterministically ... ok
test tests::yara_rule_match_escalates_to_definite ... ok
test yara_engine::tests::loads_rules_from_directory ... ok
test yara_engine::tests::parses_and_scans_rule_source ... ok

test result: ok. 52 passed; 0 failed; 9 ignored; 0 measured; 0 filtered out; finished in 102.64s

[verification-suite] 2026-02-14T13:20:04Z :: cargo build release agent-core
    Finished `release` profile [optimized] target(s) in 0.35s
[verification-suite] 2026-02-14T13:20:05Z :: binary hardening probe
[hardening] checker=readelf-fallback binary=target/release/agent-core
[hardening] full_relro=1 pie=1 nx=1 canary=0
[hardening] WARN: stack canary symbol not found (set EGUARD_HARDENING_REQUIRE_CANARY=1 to enforce)
[hardening] all checks passed
[verification-suite] 2026-02-14T13:20:05Z :: strace process/network probe
execve("./target/release/agent-core", ["./target/release/agent-core", "--help"], 0x7ffe9c282460 /* 34 vars */) = 0
socketpair(AF_UNIX, SOCK_STREAM|SOCK_CLOEXEC|SOCK_NONBLOCK, 0, [6, 7]) = 0
clone3({flags=CLONE_VM|CLONE_FS|CLONE_FILES|CLONE_SIGHAND|CLONE_THREAD|CLONE_SYSVSEM|CLONE_SETTLS|CLONE_PARENT_SETTID|CLONE_CHILD_CLEARTID, child_tid=0x7fd03ab4c990, parent_tid=0x7fd03ab4c990, exit_signal=0, stack=0x7fd03a94c000, stack_size=0x1ffd80, tls=0x7fd03ab4c6c0}strace: Process 1091985 attached
 => {parent_tid=[1091985]}, 88) = 1091985
[pid 1091984] clone3({flags=CLONE_VM|CLONE_FS|CLONE_FILES|CLONE_SIGHAND|CLONE_THREAD|CLONE_SYSVSEM|CLONE_SETTLS|CLONE_PARENT_SETTID|CLONE_CHILD_CLEARTID, child_tid=0x7fd03a94b990, parent_tid=0x7fd03a94b990, exit_signal=0, stack=0x7fd03a74b000, stack_size=0x1ffd80, tls=0x7fd03a94b6c0}strace: Process 1091986 attached
 => {parent_tid=[1091986]}, 88) = 1091986
[pid 1091984] clone3({flags=CLONE_VM|CLONE_FS|CLONE_FILES|CLONE_SIGHAND|CLONE_THREAD|CLONE_SYSVSEM|CLONE_SETTLS|CLONE_PARENT_SETTID|CLONE_CHILD_CLEARTID, child_tid=0x7fd03a74a990, parent_tid=0x7fd03a74a990, exit_signal=0, stack=0x7fd03a54a000, stack_size=0x1ffd80, tls=0x7fd03a74a6c0}strace: Process 1091987 attached
 => {parent_tid=[1091987]}, 88) = 1091987
[pid 1091984] clone3({flags=CLONE_VM|CLONE_FS|CLONE_FILES|CLONE_SIGHAND|CLONE_THREAD|CLONE_SYSVSEM|CLONE_SETTLS|CLONE_PARENT_SETTID|CLONE_CHILD_CLEARTID, child_tid=0x7fd03a549990, parent_tid=0x7fd03a549990, exit_signal=0, stack=0x7fd03a349000, stack_size=0x1ffd80, tls=0x7fd03a5496c0}strace: Process 1091988 attached
 => {parent_tid=[1091988]}, 88) = 1091988
[pid 1091984] clone3({flags=CLONE_VM|CLONE_FS|CLONE_FILES|CLONE_SIGHAND|CLONE_THREAD|CLONE_SYSVSEM|CLONE_SETTLS|CLONE_PARENT_SETTID|CLONE_CHILD_CLEARTID, child_tid=0x7fd03a348990, parent_tid=0x7fd03a348990, exit_signal=0, stack=0x7fd03a148000, stack_size=0x1ffd80, tls=0x7fd03a3486c0}strace: Process 1091989 attached
 => {parent_tid=[1091989]}, 88) = 1091989
[pid 1091984] clone3({flags=CLONE_VM|CLONE_FS|CLONE_FILES|CLONE_SIGHAND|CLONE_THREAD|CLONE_SYSVSEM|CLONE_SETTLS|CLONE_PARENT_SETTID|CLONE_CHILD_CLEARTID, child_tid=0x7fd03a147990, parent_tid=0x7fd03a147990, exit_signal=0, stack=0x7fd039f47000, stack_size=0x1ffd80, tls=0x7fd03a1476c0}strace: Process 1091990 attached
 => {parent_tid=[1091990]}, 88) = 1091990
[pid 1091984] clone3({flags=CLONE_VM|CLONE_FS|CLONE_FILES|CLONE_SIGHAND|CLONE_THREAD|CLONE_SYSVSEM|CLONE_SETTLS|CLONE_PARENT_SETTID|CLONE_CHILD_CLEARTID, child_tid=0x7fd039f46990, parent_tid=0x7fd039f46990, exit_signal=0, stack=0x7fd039d46000, stack_size=0x1ffd80, tls=0x7fd039f466c0} => {parent_tid=[1091991]}, 88) = 1091991
strace: Process 1091991 attached
[pid 1091984] clone3({flags=CLONE_VM|CLONE_FS|CLONE_FILES|CLONE_SIGHAND|CLONE_THREAD|CLONE_SYSVSEM|CLONE_SETTLS|CLONE_PARENT_SETTID|CLONE_CHILD_CLEARTID, child_tid=0x7fd039d42990, parent_tid=0x7fd039d42990, exit_signal=0, stack=0x7fd039b42000, stack_size=0x1ffd80, tls=0x7fd039d426c0}strace: Process 1091992 attached
 => {parent_tid=[1091992]}, 88) = 1091992
[pid 1091984] clone3({flags=CLONE_VM|CLONE_FS|CLONE_FILES|CLONE_SIGHAND|CLONE_THREAD|CLONE_SYSVSEM|CLONE_SETTLS|CLONE_PARENT_SETTID|CLONE_CHILD_CLEARTID, child_tid=0x7fd039b38990, parent_tid=0x7fd039b38990, exit_signal=0, stack=0x7fd039938000, stack_size=0x1ffd80, tls=0x7fd039b386c0}strace: Process 1091993 attached
 => {parent_tid=[1091993]}, 88) = 1091993
[pid 1091984] clone3({flags=CLONE_VM|CLONE_FS|CLONE_FILES|CLONE_SIGHAND|CLONE_THREAD|CLONE_SYSVSEM|CLONE_SETTLS|CLONE_PARENT_SETTID|CLONE_CHILD_CLEARTID, child_tid=0x7fd039934990, parent_tid=0x7fd039934990, exit_signal=0, stack=0x7fd039734000, stack_size=0x1ffd80, tls=0x7fd0399346c0}strace: Process 1091994 attached
 => {parent_tid=[1091994]}, 88) = 1091994
[pid 1091984] clone3({flags=CLONE_VM|CLONE_FS|CLONE_FILES|CLONE_SIGHAND|CLONE_THREAD|CLONE_SYSVSEM|CLONE_SETTLS|CLONE_PARENT_SETTID|CLONE_CHILD_CLEARTID, child_tid=0x7fd039730990, parent_tid=0x7fd039730990, exit_signal=0, stack=0x7fd039530000, stack_size=0x1ffd80, tls=0x7fd0397306c0}strace: Process 1091995 attached
 => {parent_tid=[1091995]}, 88) = 1091995
[pid 1091984] clone3({flags=CLONE_VM|CLONE_FS|CLONE_FILES|CLONE_SIGHAND|CLONE_THREAD|CLONE_SYSVSEM|CLONE_SETTLS|CLONE_PARENT_SETTID|CLONE_CHILD_CLEARTID, child_tid=0x7fd03952c990, parent_tid=0x7fd03952c990, exit_signal=0, stack=0x7fd03932c000, stack_size=0x1ffd80, tls=0x7fd03952c6c0}strace: Process 1091996 attached
 => {parent_tid=[1091996]}, 88) = 1091996
[pid 1091984] clone3({flags=CLONE_VM|CLONE_FS|CLONE_FILES|CLONE_SIGHAND|CLONE_THREAD|CLONE_SYSVSEM|CLONE_SETTLS|CLONE_PARENT_SETTID|CLONE_CHILD_CLEARTID, child_tid=0x7fd039328990, parent_tid=0x7fd039328990, exit_signal=0, stack=0x7fd039128000, stack_size=0x1ffd80, tls=0x7fd0393286c0}strace: Process 1091997 attached
 => {parent_tid=[1091997]}, 88) = 1091997
[pid 1091984] clone3({flags=CLONE_VM|CLONE_FS|CLONE_FILES|CLONE_SIGHAND|CLONE_THREAD|CLONE_SYSVSEM|CLONE_SETTLS|CLONE_PARENT_SETTID|CLONE_CHILD_CLEARTID, child_tid=0x7fd039124990, parent_tid=0x7fd039124990, exit_signal=0, stack=0x7fd038f24000, stack_size=0x1ffd80, tls=0x7fd0391246c0}strace: Process 1091998 attached
 => {parent_tid=[1091998]}, 88) = 1091998
[pid 1091984] clone3({flags=CLONE_VM|CLONE_FS|CLONE_FILES|CLONE_SIGHAND|CLONE_THREAD|CLONE_SYSVSEM|CLONE_SETTLS|CLONE_PARENT_SETTID|CLONE_CHILD_CLEARTID, child_tid=0x7fd038f20990, parent_tid=0x7fd038f20990, exit_signal=0, stack=0x7fd038d20000, stack_size=0x1ffd80, tls=0x7fd038f206c0}strace: Process 1091999 attached
 => {parent_tid=[1091999]}, 88) = 1091999
[pid 1091984] clone3({flags=CLONE_VM|CLONE_FS|CLONE_FILES|CLONE_SIGHAND|CLONE_THREAD|CLONE_SYSVSEM|CLONE_SETTLS|CLONE_PARENT_SETTID|CLONE_CHILD_CLEARTID, child_tid=0x7fd038d1c990, parent_tid=0x7fd038d1c990, exit_signal=0, stack=0x7fd038b1c000, stack_size=0x1ffd80, tls=0x7fd038d1c6c0}strace: Process 1092000 attached
 => {parent_tid=[1092000]}, 88) = 1092000
[pid 1091984] clone3(0x7ffe966c7fe0, 88strace: Process 1092001 attached
) = 1092001
[pid 1092001] socket(AF_UNIX, SOCK_STREAM|SOCK_CLOEXEC|SOCK_NONBLOCK, 0) = 9
[pid 1092001] connect(9, 0x7fd038ad1c70, 110) = -1 ENOENT (No such file or directory)
[pid 1092001] socket(AF_UNIX, SOCK_STREAM|SOCK_CLOEXEC|SOCK_NONBLOCK, 0) = 9
[pid 1092001] connect(9, 0x7fd038ad1e60, 110) = -1 ENOENT (No such file or directory)
[pid 1092001] socket(AF_INET, SOCK_DGRAM|SOCK_CLOEXEC|SOCK_NONBLOCK, IPPROTO_IP) = 9
[pid 1092001] setsockopt(9, SOL_IP, IP_RECVERR, 0x7fd038ad02a4, 4) = 0
[pid 1092001] connect(9, 0x7fd038ad3d8c, 16) = 0
[pid 1092001] sendmmsg(9, 0x7fd038ad0440, 2, MSG_NOSIGNAL) = 2
[pid 1092001] recvfrom(9, 0x7fd038ad1790, 2048, 0, 0x7fd038ad0420, 0x7fd038ad0400) = 43
[pid 1092001] recvfrom(9, 0x7fcff8003aa0, 65536, 0, 0x7fd038ad0420, 0x7fd038ad0400) = 43
[pid 1092001] socket(AF_INET, SOCK_DGRAM|SOCK_CLOEXEC|SOCK_NONBLOCK, IPPROTO_IP) = 9
[pid 1092001] setsockopt(9, SOL_IP, IP_RECVERR, 0x7fd038ad0754, 4) = 0
[pid 1092001] connect(9, 0x7fd038ad3d8c, 16) = 0
[pid 1092001] sendmmsg(9, 0x7fd038ad08f0, 2, MSG_NOSIGNAL) = 2
[pid 1092001] recvfrom(9, 0x7fd038ad1790, 2048, 0, 0x7fd038ad08d0, 0x7fd038ad08b0) = 31
[pid 1092001] recvfrom(9, 0x7fcff8003aa0, 65536, 0, 0x7fd038ad08d0, 0x7fd038ad08b0) = 31
[pid 1092001] socket(AF_INET, SOCK_DGRAM|SOCK_CLOEXEC|SOCK_NONBLOCK, IPPROTO_IP) = 9
[pid 1092001] setsockopt(9, SOL_IP, IP_RECVERR, 0x7fd038ad02a4, 4) = 0
[pid 1092001] connect(9, 0x7fd038ad3d8c, 16) = 0
[pid 1092001] sendmmsg(9, 0x7fd038ad0440, 2, MSG_NOSIGNAL) = 2
[pid 1092001] recvfrom(9, 0x7fd038ad1790, 2048, 0, 0x7fd038ad0420, 0x7fd038ad0400) = 43
[pid 1092001] recvfrom(9, 0x7fcff8003af0, 65536, 0, 0x7fd038ad0420, 0x7fd038ad0400) = 43
[pid 1092001] socket(AF_INET, SOCK_DGRAM|SOCK_CLOEXEC|SOCK_NONBLOCK, IPPROTO_IP) = 9
[pid 1092001] setsockopt(9, SOL_IP, IP_RECVERR, 0x7fd038ad0754, 4) = 0
[pid 1092001] connect(9, 0x7fd038ad3d8c, 16) = 0
[pid 1092001] sendmmsg(9, 0x7fd038ad08f0, 2, MSG_NOSIGNAL) = 2
[pid 1092001] recvfrom(9, 0x7fd038ad1790, 2048, 0, 0x7fd038ad08d0, 0x7fd038ad08b0) = 31
[pid 1092001] recvfrom(9, 0x7fcff8003af0, 65536, 0, 0x7fd038ad08d0, 0x7fd038ad08b0) = 31
[pid 1092001] socket(AF_INET, SOCK_DGRAM|SOCK_CLOEXEC|SOCK_NONBLOCK, IPPROTO_IP) = 9
[pid 1092001] setsockopt(9, SOL_IP, IP_RECVERR, 0x7fd038ad02a4, 4) = 0
[pid 1092001] connect(9, 0x7fd038ad3d8c, 16) = 0
[pid 1092001] sendmmsg(9, 0x7fd038ad0440, 2, MSG_NOSIGNAL) = 2
[pid 1092001] recvfrom(9, 0x7fd038ad1790, 2048, 0, 0x7fd038ad0420, 0x7fd038ad0400) = 43
[pid 1092001] recvfrom(9, 0x7fcff8003b40, 65536, 0, 0x7fd038ad0420, 0x7fd038ad0400) = 43
[pid 1092001] socket(AF_INET, SOCK_DGRAM|SOCK_CLOEXEC|SOCK_NONBLOCK, IPPROTO_IP) = 9
[pid 1092001] setsockopt(9, SOL_IP, IP_RECVERR, 0x7fd038ad0754, 4) = 0
[pid 1092001] connect(9, 0x7fd038ad3d8c, 16) = 0
[pid 1092001] sendmmsg(9, 0x7fd038ad08f0, 2, MSG_NOSIGNAL) = 2
[pid 1092001] recvfrom(9, 0x7fd038ad1790, 2048, 0, 0x7fd038ad08d0, 0x7fd038ad08b0) = 31
[pid 1092001] recvfrom(9, 0x7fcff8003b40, 65536, 0, 0x7fd038ad08d0, 0x7fd038ad08b0) = 31
[pid 1092001] exit(0)                   = ?
[pid 1092001] +++ exited with 0 +++
strace: Process 1091984 detached
strace: Process 1091985 detached
strace: Process 1091986 detached
strace: Process 1091987 detached
strace: Process 1091988 detached
strace: Process 1091989 detached
strace: Process 1091990 detached
strace: Process 1091991 detached
strace: Process 1091992 detached
strace: Process 1091993 detached
strace: Process 1091994 detached
strace: Process 1091995 detached
strace: Process 1091996 detached
strace: Process 1091997 detached
strace: Process 1091998 detached
strace: Process 1091999 detached
strace: Process 1092000 detached
[verification-suite] 2026-02-14T13:21:05Z :: grpc-client enrollment test aliases
    Finished `test` profile [unoptimized + debuginfo] target(s) in 0.23s
     Running unittests src/lib.rs (target/debug/deps/grpc_client-e8d3c22ab94ee9c0)

running 0 tests

test result: ok. 0 passed; 0 failed; 0 ignored; 0 measured; 79 filtered out; finished in 0.00s

    Finished `test` profile [unoptimized + debuginfo] target(s) in 0.23s
     Running unittests src/lib.rs (target/debug/deps/grpc_client-e8d3c22ab94ee9c0)

running 1 test
test client::tests::enrollment_rejects_expired_or_wrong_ca_certificates ... ok

test result: ok. 1 passed; 0 failed; 0 ignored; 0 measured; 78 filtered out; finished in 3.40s

[verification-suite] 2026-02-14T13:21:09Z :: platform-linux lsm payload parse test
    Finished `test` profile [unoptimized + debuginfo] target(s) in 0.12s
     Running unittests src/lib.rs (target/debug/deps/platform_linux-80117e0f4d703077)

running 1 test
test ebpf::tests::parses_structured_lsm_block_payload ... ok

test result: ok. 1 passed; 0 failed; 0 ignored; 0 measured; 52 filtered out; finished in 0.00s

[verification-suite] 2026-02-14T13:21:09Z :: agent-core shard IOC reload test
   Compiling h2 v0.4.13
   Compiling rustls v0.23.36
   Compiling regex-automata v0.4.14
   Compiling rusqlite v0.32.1
   Compiling idna v1.1.0
   Compiling asn1-rs v0.6.2
   Compiling cipher v0.4.4
   Compiling tonic-build v0.12.3
   Compiling num-integer v0.1.46
   Compiling universal-hash v0.5.1
   Compiling opaque-debug v0.3.1
   Compiling lazy_static v1.5.0
   Compiling tower-http v0.6.8
   Compiling polyval v0.6.2
   Compiling grpc-client v0.1.0 (/home/dimas/eguard-agent/crates/grpc-client)
   Compiling scroll v0.12.0
   Compiling num-bigint v0.4.6
   Compiling url v2.5.8
   Compiling tower v0.4.13
   Compiling rustix v1.1.3
   Compiling signature v2.2.0
   Compiling plain v0.2.3
   Compiling goblin v0.8.2
   Compiling ed25519 v2.2.3
   Compiling hyper v1.8.1
   Compiling der-parser v9.0.0
   Compiling regex v1.12.3
   Compiling matchers v0.2.0
   Compiling xattr v1.6.1
   Compiling tokio-rustls v0.26.4
   Compiling curve25519-dalek v4.1.3
   Compiling hyper-util v0.1.20
   Compiling nix v0.30.1
   Compiling crypto-accel v0.1.0 (/home/dimas/eguard-agent/crates/crypto-accel)
   Compiling ghash v0.5.1
   Compiling oid-registry v0.7.1
   Compiling detection v0.1.0 (/home/dimas/eguard-agent/crates/detection)
   Compiling sharded-slab v0.1.7
   Compiling hyper-timeout v0.5.2
   Compiling hyper-rustls v0.27.7
   Compiling tonic v0.12.3
   Compiling reqwest v0.12.28
   Compiling aes v0.8.4
   Compiling ctr v0.9.2
   Compiling tracing-log v0.2.0
   Compiling aead v0.5.2
   Compiling filetime v0.2.27
   Compiling thread_local v1.1.9
   Compiling nu-ansi-term v0.50.3
   Compiling data-encoding v2.10.0
   Compiling tar v0.4.44
   Compiling tracing-subscriber v0.3.22
   Compiling x509-parser v0.16.0
   Compiling aes-gcm v0.10.3
   Compiling response v0.1.0 (/home/dimas/eguard-agent/crates/response)
   Compiling self-protect v0.1.0 (/home/dimas/eguard-agent/crates/self-protect)
   Compiling platform-linux v0.1.0 (/home/dimas/eguard-agent/crates/platform-linux)
   Compiling ed25519-dalek v2.2.0
   Compiling arc-swap v1.8.1
   Compiling agent-core v0.1.0 (/home/dimas/eguard-agent/crates/agent-core)
    Finished `test` profile [unoptimized + debuginfo] target(s) in 24.98s
     Running unittests src/main.rs (target/debug/deps/agent_core-74c39e3a962b6fa0)

running 1 test
test lifecycle::tests::reload_detection_state_from_bundle_populates_ioc_layers_on_all_shards ... ok

test result: ok. 1 passed; 0 failed; 0 ignored; 0 measured; 115 filtered out; finished in 0.03s

[verification-suite] 2026-02-14T13:21:34Z :: perf profile gate
perf unavailable; wrote skipped profile gate metrics to /home/dimas/eguard-agent/artifacts/perf-profile-gate/metrics.json
[verification-suite] 2026-02-14T13:21:34Z :: release profile optimization gate
    Finished `release` profile [optimized] target(s) in 0.28s
wrote release profile optimization metrics to /home/dimas/eguard-agent/artifacts/release-profile-opt/metrics.json
[verification-suite] 2026-02-14T13:21:35Z :: detection quality gate
    Finished `test` profile [unoptimized + debuginfo] target(s) in 0.12s
     Running unittests src/lib.rs (target/debug/deps/detection-d2b994980045afa0)

running 1 test
test tests::replay_quality_gate_emits_metrics_artifact ... ok

test result: ok. 1 passed; 0 failed; 0 ignored; 0 measured; 73 filtered out; finished in 0.32s

detection-quality trend drift check passed
Adversary-emulation score snapshot:
- focus score: 99.7076
- final score: 99.7076
- previous final score: 99.7076
- final score drop: 0.0000

Adversary-emulation score gate passed
wrote detection quality gate metrics to /home/dimas/eguard-agent/artifacts/detection-quality-gate/metrics.json
updated detection quality trend artifact /home/dimas/eguard-agent/artifacts/detection-quality-gate/per-confidence-trend.ndjson
wrote detection quality trend drift report /home/dimas/eguard-agent/artifacts/detection-quality-gate/trend-drift-report.json
wrote adversary-emulation score report /home/dimas/eguard-agent/artifacts/detection-quality-gate/adversary-emulation-score.json
[verification-suite] 2026-02-14T13:21:35Z :: ebpf drop-rate pressure gate
    Finished `test` profile [unoptimized + debuginfo] target(s) in 0.12s
     Running unittests src/lib.rs (target/debug/deps/platform_linux-80117e0f4d703077)

running 1 test
test ebpf::tests::drop_rate_stays_below_slo_for_reference_10k_event_batch ... ok

test result: ok. 1 passed; 0 failed; 0 ignored; 0 measured; 52 filtered out; finished in 0.02s

wrote eBPF drop-rate pressure metrics to /home/dimas/eguard-agent/artifacts/ebpf-drop-rate-pressure/metrics.json
[verification-suite] 2026-02-14T13:21:36Z :: verification suite completed
